{
    "$schema": "../species.schema.json",
    "name": "Samurott",
    "pokedex": {
        "category": "Formidable Pokémon",
        "entry": "In the time it takes a foe to blink,\nit can draw and sheathe the seamitars\nattached to its front legs.",
        "height": "4'11\"",
        "weight": "208.6 lbs.",
        "languages": {
            "ja": {
                "category": "かんろくポケモン"
            }
        }
    },
    "base_stats": {
        "hp": 95,
        "attack": 100,
        "defense": 85,
        "speed": 70,
        "special_attack": 108,
        "special_defense": 70
    },
    "types": [ "TYPE_WATER", "TYPE_WATER" ],
    "catch_rate": 45,
    "evolution_stage": 3,
    "ev_yields": {
        "hp": 0,
        "attack": 0,
        "defense": 0,
        "speed": 0,
        "special_attack": 3,
        "special_defense": 0
    },
    "underground": false,
    "held_items": {
        "common": "ITEM_NONE",
        "rare": "ITEM_NONE",
        "very_rare": "ITEM_NONE"
    },
    "gender_ratio": 31,
    "hatch_cycles": 20,
    "base_friendship": 70,
    "growth_rate": "GROWTH_MEDIUM_SLOW",
    "egg_groups": [ "EGG_GROUP_FIELD", "EGG_GROUP_FIELD" ],
    "abilities": [ "ABILITY_TORRENT", "ABILITY_TORRENT" ],
    "hidden_ability": "ABILITY_SHELL_ARMOR",
    "flee_rate": 0,
    "forms": {
        "count": 1,
        "sprite_offset": 0
    },
    "color": "COLOR_BLUE",
    "asymmetric": false,
    "palette_forms": false,
    "base_exp": 238,
    "height": 15,
    "weight": 946,
    "learnset": {
        "by_level": [
            [ 1, "MOVE_MEGAHORN" ],
            [ 1, "MOVE_TACKLE" ],
            [ 1, "MOVE_TAIL_WHIP" ],
            [ 1, "MOVE_WATER_GUN" ],
            [ 1, "MOVE_WATER_SPORT" ],
            [ 5, "MOVE_TAIL_WHIP" ],
            [ 7, "MOVE_WATER_GUN" ],
            [ 11, "MOVE_WATER_SPORT" ],
            [ 13, "MOVE_FOCUS_ENERGY" ],
            [ 17, "MOVE_RAZOR_SHELL" ],
            [ 20, "MOVE_FURY_CUTTER" ],
            [ 25, "MOVE_WATER_PULSE" ],
            [ 28, "MOVE_REVENGE" ],
            [ 33, "MOVE_AQUA_JET" ],
            [ 36, "MOVE_SLASH" ],
            [ 38, "MOVE_ENCORE" ],
            [ 45, "MOVE_AQUA_TAIL" ],
            [ 50, "MOVE_RETALIATE" ],
            [ 57, "MOVE_SWORDS_DANCE" ],
            [ 62, "MOVE_HYDRO_PUMP" ]
        ],
        "by_tm": [
            "TM06",
            "TM07",
            "TM10",
            "TM12",
            "TM13",
            "TM14",
            "TM15",
            "TM17",
            "TM18",
            "TM21",
            "TM27",
            "TM28",
            "TM32",
            "TM40",
            "TM42",
            "TM44",
            "TM45",
            "TM48",
            "TM54",
            "TM55",
            "TM56",
            "TM67",
            "TM68",
            "TM75",
            "TM81",
            "TM82",
            "TM86",
            "TM87",
            "TM90",
            "TM94",
            "HM01",
            "HM03",
            "HM04",
            "HM05",
            "HM06"
        ],
        "by_tutor": [
            "MOVE_WATER_PLEDGE",
            "MOVE_HYDRO_CANNON",
            "MOVE_COVET",
            "MOVE_BLOCK",
            "MOVE_SUPERPOWER",
            "MOVE_ICY_WIND",
            "MOVE_AQUA_TAIL",
            "MOVE_IRON_TAIL",
            "MOVE_SNORE",
            "MOVE_KNOCK_OFF",
            "MOVE_HELPING_HAND",
            "MOVE_SLEEP_TALK"
        ],
        "egg_moves": []
    },
    "evolutions": [],
    "regional_dex_number": 9,
    "baby_species": "SPECIES_OSHAWOTT",
    "cry_volume": 110
}
