{
    "$schema": "../species.schema.json",
    "name": "Metapod",
    "pokedex": {
        "category": "Cocoon Pokémon",
        "entry": "A steel-hard shell protects its\ntender body. It quietly endures\nhardships while awaiting evolution.",
        "height": "2'04\"",
        "weight": "21.8 lbs.",
        "languages": {
            "en": {
                "name": "Metapod",
                "category": "Cocoon Pokémon",
                "entry": "A steel-hard shell protects its\ntender body. It quietly endures\nhardships while awaiting evolution.",
                "height": "2'04\"",
                "weight": "21.8 lbs."
            },
            "fr": {
                "name": "Chrysacier",
                "category": "Pokémon Cocon",
                "entry": "Son corps frêle est protégé par sa\ncarapace d'acier. Il encaisse les\ncoups durs en attendant d'évoluer.",
                "height": "0,7 m",
                "weight": "9,9 kg"
            },
            "de": {
                "name": "Safcon",
                "category": "Kokon",
                "entry": "Der stahlharte Panzer schützt\nseinen zarten Körper. Es wartet\ngeduldig auf seine Entwicklung.",
                "height": "0,7 m",
                "weight": "9,9 kg"
            },
            "it": {
                "name": "Metapod",
                "category": "Pokémon Bozzolo",
                "entry": "Ha una corazza dura come l'acciaio che\nprotegge il suo fragile corpo. Attende\nimmobile di evolversi.",
                "height": "0,7 m",
                "weight": "9,9 kg"
            },
            "ko": {
                "name": "단데기",
                "category": "번데기포켓몬",
                "entry": "강철같이 단단한 껍질로\n부드러운 몸을 보호하고 있다.\n진화할 때까지 가만히 참고 있다.",
                "height": "0.7 m",
                "weight": "9.9 kg"
            },
            "es": {
                "name": "Metapod",
                "category": "Pokémon Capullo",
                "entry": "Su frágil cuerpo está recubierto\nde una coraza dura como el acero.\nPermanece quieto en su desarrollo.",
                "height": "0,7 m",
                "weight": "9,9 kg"
            },
            "ja": {
                "name": "トランセル",
                "category": "さなぎポケモン",
                "entry": "こうてつのように\\x{3000}かたい\\x{3000}カラで\nやわらかい\\x{3000}なかみを\\x{3000}まもっている。\nしんかするまで\\x{3000}じっと\\x{3000}たえている。",
                "height": "\\x{ff10}\\x{ff0e}\\x{ff17}\\x{ff4d}",
                "weight": "\\x{ff19}\\x{ff0e}\\x{ff19}\\x{ff4b}\\x{ff47}"
            }
        }
    },
    "base_stats": {
        "hp": 50,
        "attack": 20,
        "defense": 55,
        "speed": 30,
        "special_attack": 25,
        "special_defense": 25
    },
    "types": [ "TYPE_BUG", "TYPE_BUG" ],
    "catch_rate": 120,
    "evolution_stage": 2,
    "ev_yields": {
        "hp": 0,
        "attack": 0,
        "defense": 2,
        "speed": 0,
        "special_attack": 0,
        "special_defense": 0
    },
    "underground": false,
    "held_items": {
        "common": "ITEM_NONE",
        "rare": "ITEM_NONE",
        "very_rare": "ITEM_NONE"
    },
    "gender_ratio": 127,
    "hatch_cycles": 15,
    "base_friendship": 70,
    "growth_rate": "GROWTH_MEDIUM_FAST",
    "egg_groups": [ "EGG_GROUP_BUG", "EGG_GROUP_BUG" ],
    "abilities": [ "ABILITY_SHED_SKIN", "ABILITY_NONE" ],
    "hidden_ability": "ABILITY_SHED_SKIN",
    "flee_rate": 0,
    "forms": {
        "count": 1,
        "sprite_offset": 0
    },
    "color": "COLOR_GREEN",
    "asymmetric": false,
    "palette_forms": false,
    "base_exp": 72,
    "height": 7,
    "weight": 99,
    "learnset": {
        "by_level": [
            [ 1, "MOVE_HARDEN" ],
            [ 7, "MOVE_HARDEN" ]
        ],
        "by_tm": [],
        "by_tutor": [ "MOVE_BUG_BITE", "MOVE_IRON_DEFENSE", "MOVE_ELECTROWEB" ],
        "egg_moves": []
    },
    "evolutions": [
        {
            "method": "EVO_METHOD_LEVEL",
            "param": 10,
            "species": "SPECIES_BUTTERFREE"
        }
    ],
    "regional_dex_number": null,
    "baby_species": "SPECIES_CATERPIE",
    "cry_volume": 110
}
