{
    "$schema": "../species.schema.json",
    "name": "Escavalier",
    "pokedex": {
        "category": "Cavalry Pokémon",
        "entry": "Wearing the shell covering they stole\nfrom Shelmet, they defend themselves\nand attack with two lances.",
        "height": "3'03\"",
        "weight": "72.8 lbs.",
        "languages": {
            "ja": {
                "category": "きへいポケモン"
            }
        }
    },
    "base_stats": {
        "hp": 70,
        "attack": 135,
        "defense": 105,
        "speed": 20,
        "special_attack": 60,
        "special_defense": 105
    },
    "types": [ "TYPE_BUG", "TYPE_STEEL" ],
    "catch_rate": 75,
    "evolution_stage": 2,
    "ev_yields": {
        "hp": 0,
        "attack": 2,
        "defense": 0,
        "speed": 0,
        "special_attack": 0,
        "special_defense": 0
    },
    "underground": false,
    "held_items": {
        "common": "ITEM_NONE",
        "rare": "ITEM_NONE",
        "very_rare": "ITEM_NONE"
    },
    "gender_ratio": 127,
    "hatch_cycles": 15,
    "base_friendship": 70,
    "growth_rate": "GROWTH_MEDIUM_FAST",
    "egg_groups": [ "EGG_GROUP_BUG", "EGG_GROUP_BUG" ],
    "abilities": [ "ABILITY_SWARM", "ABILITY_SHELL_ARMOR" ],
    "hidden_ability": "ABILITY_OVERCOAT",
    "flee_rate": 0,
    "forms": {
        "count": 1,
        "sprite_offset": 0
    },
    "color": "COLOR_GRAY",
    "asymmetric": false,
    "palette_forms": false,
    "base_exp": 173,
    "height": 10,
    "weight": 330,
    "learnset": {
        "by_level": [
            [ 1, "MOVE_PECK" ],
            [ 1, "MOVE_LEER" ],
            [ 1, "MOVE_QUICK_GUARD" ],
            [ 1, "MOVE_TWINEEDLE" ],
            [ 4, "MOVE_LEER" ],
            [ 8, "MOVE_QUICK_GUARD" ],
            [ 13, "MOVE_TWINEEDLE" ],
            [ 16, "MOVE_FURY_ATTACK" ],
            [ 20, "MOVE_HEADBUTT" ],
            [ 25, "MOVE_FALSE_SWIPE" ],
            [ 28, "MOVE_BUG_BUZZ" ],
            [ 32, "MOVE_SLASH" ],
            [ 37, "MOVE_IRON_HEAD" ],
            [ 40, "MOVE_IRON_DEFENSE" ],
            [ 44, "MOVE_X_SCISSOR" ],
            [ 49, "MOVE_REVERSAL" ],
            [ 52, "MOVE_SWORDS_DANCE" ],
            [ 56, "MOVE_GIGA_IMPACT" ]
        ],
        "by_tm": [
            "TM06",
            "TM10",
            "TM15",
            "TM17",
            "TM18",
            "TM21",
            "TM27",
            "TM32",
            "TM40",
            "TM42",
            "TM44",
            "TM45",
            "TM48",
            "TM52",
            "TM53",
            "TM54",
            "TM68",
            "TM75",
            "TM76",
            "TM81",
            "TM84",
            "TM87",
            "TM90",
            "TM94",
            "HM01"
        ],
        "by_tutor": [
            "MOVE_BUG_BITE",
            "MOVE_IRON_HEAD",
            "MOVE_IRON_DEFENSE",
            "MOVE_SNORE",
            "MOVE_KNOCK_OFF",
            "MOVE_GIGA_DRAIN",
            "MOVE_SLEEP_TALK"
        ],
        "egg_moves": []
    },
    "evolutions": [],
    "regional_dex_number": 156,
    "baby_species": "SPECIES_KARRABLAST",
    "cry_volume": 120
}
